title,type,agency_names,abstract,document_number,html_url,pdf_url,publication_date
Assessment and Apportionment of Administrative Expenses,Rule,Farm Credit Administration,"The Farm Credit Administration (FCA or we) issued a direct final rule adopting technical amendments to eliminate language that is obsolete, confusing, and unnecessary to determine the annual assessment amount of Farm Credit System institutions. In accordance with the law, the effective date of the rule is no earlier than 30 days from the date of publication in the Federal Register during which either or both Houses of Congress are in session.", 2017-26835,https://www.federalregister.gov/documents/2017/12/13/2017-26835/assessment-and-apportionment-of-administrative-expenses,https://www.gpo.gov/fdsys/pkg/FR-2017-12-13/pdf/2017-26835.pdf,12/13/2017
Airworthiness Directives; ATR-GIE Avions de Transport Régional Airplanes,Rule,Transportation Department; Federal Aviation Administration,We are adopting a new airworthiness directive (AD) for certain ATR-GIE Avions de Transport R[eacute]gional Model ATR42-500 and ATR72- 212A airplanes. This AD requires revising the airplane flight manual to provide procedures to the flightcrew for operational restrictions affecting in-flight use of the autopilot (AP) or yaw damper (YD) during single source operation. This AD was prompted by flight test evaluations that revealed discrepancies with the YD and AP when in single source operation on certain airplanes. We are issuing this AD to address the unsafe condition on these products., 2017-26621,https://www.federalregister.gov/documents/2017/12/13/2017-26621/airworthiness-directives-atr-gie-avions-de-transport-rgional-airplanes,https://www.gpo.gov/fdsys/pkg/FR-2017-12-13/pdf/2017-26621.pdf,12/13/2017
Extension of the Prohibition Against Certain Flights in the Territory and Airspace of Somalia,Rule,Transportation Department; Federal Aviation Administration,"This action extends the expiration date for the Special Federal Aviation Regulation (SFAR) that prohibits certain flights in the territory and airspace of Somalia at altitudes below flight level (FL) 260 by all: United States (U.S.) air carriers; U.S. commercial operators; persons exercising the privileges of an airman certificate issued by the FAA, except when such persons are operating U.S.- registered aircraft for a foreign air carrier; and operators of U.S.- registered civil aircraft, except where the operator of such aircraft is a foreign air carrier. The FAA is taking this action because it has determined that there continues to be an unacceptable risk to U.S. civil aviation operating in the territory and airspace of Somalia at altitudes below FL260 resulting from terrorist and militant activity. The FAA also republishes, with minor revisions, the approval process and exemption information for this SFAR.", 2017-26847,https://www.federalregister.gov/documents/2017/12/13/2017-26847/extension-of-the-prohibition-against-certain-flights-in-the-territory-and-airspace-of-somalia,https://www.gpo.gov/fdsys/pkg/FR-2017-12-13/pdf/2017-26847.pdf,12/13/2017
"Direct Investment Surveys: BE-12, Benchmark Survey of Foreign Direct Investment in the United States",Rule,Commerce Department; Economic Analysis Bureau,"This final rule amends regulations of the Department of Commerce's Bureau of Economic Analysis (BEA) to set forth the reporting requirements for the 2017 BE-12, Benchmark Survey of Foreign Direct Investment in the United States. The BE-12 survey is conducted every five years; the prior survey covered 2012. The benchmark survey covers the universe of foreign direct investment in the United States and is BEA's most detailed survey of such investment. For the 2017 benchmark survey, BEA will make changes in data items collected, the design of the survey forms, and the reporting requirements for the survey to satisfy changing data needs and to improve data quality and the effectiveness and efficiency of data collection.", 2017-26887,https://www.federalregister.gov/documents/2017/12/13/2017-26887/direct-investment-surveys-be-12-benchmark-survey-of-foreign-direct-investment-in-the-united-states,https://www.gpo.gov/fdsys/pkg/FR-2017-12-13/pdf/2017-26887.pdf,12/13/2017
Advisory Committee; Food Advisory Committee; Termination,Rule,Health and Human Services Department; Food and Drug Administration,The Food and Drug Administration (FDA) is announcing the termination of the Food Advisory Committee. This document removes the Food Advisory Committee from the Agency's list of standing advisory committees., 2017-26829,https://www.federalregister.gov/documents/2017/12/13/2017-26829/advisory-committee-food-advisory-committee-termination,https://www.gpo.gov/fdsys/pkg/FR-2017-12-13/pdf/2017-26829.pdf,12/13/2017
New Animal Drugs; Approval of New Animal Drug Applications,Rule,Health and Human Services Department; Food and Drug Administration,"The Food and Drug Administration (FDA or we) is amending the animal drug regulations to reflect application-related actions for a new animal drug application (NADA) and abbreviated new animal drug applications (ANADAs) during May and June 2017. FDA is informing the public of the availability of summaries of the basis of approval and of environmental review documents, where applicable. The animal drug regulations are also being amended to make technical amendments to improve the accuracy of the regulations.", 2017-26753,https://www.federalregister.gov/documents/2017/12/13/2017-26753/new-animal-drugs-approval-of-new-animal-drug-applications,https://www.gpo.gov/fdsys/pkg/FR-2017-12-13/pdf/2017-26753.pdf,12/13/2017
Schedules of Controlled Substances: Placement of MT-45 Into Schedule I,Rule,Justice Department; Drug Enforcement Administration,"With the issuance of this final order, the Administrator of the Drug Enforcement Administration places the substance MT-45 (Systematic IUPAC Name: 1-cyclohexyl-4-(1,2-diphenylethyl)piperazine), including its salts, isomers, and salts of isomers into schedule I of the Controlled Substances Act. This scheduling action is pursuant to the Controlled Substances Act and is required in order for the United States to discharge its obligations under the Single Convention on Narcotic Drugs, 1961. This action imposes the regulatory controls and administrative, civil, and criminal sanctions applicable to schedule I controlled substances on persons who handle (manufacture, distribute, import, export, engage in research or conduct instructional activities with, or possess), or propose to handle, MT-45.", 2017-26853,https://www.federalregister.gov/documents/2017/12/13/2017-26853/schedules-of-controlled-substances-placement-of-mt-45-into-schedule-i,https://www.gpo.gov/fdsys/pkg/FR-2017-12-13/pdf/2017-26853.pdf,12/13/2017
Oklahoma Regulatory Program,Rule,Interior Department; Surface Mining Reclamation and Enforcement Office,"We, the Office of Surface Mining Reclamation and Enforcement (OSMRE), are approving an amendment to the Oklahoma regulatory program (Oklahoma program) under the Surface Mining Control and Reclamation Act of 1977 (SMCRA or the Act). Oklahoma proposed revisions to its regulations regarding: Permit eligibility for permits with violations on lands eligible for remining; permit suspension or rescission posting locations and appeal procedures; requiring GPS coordinates for aspects of permit maps; topsoil removal distances; blasting records requirements; annual reporting requirements; temporary cessation of operations requirements; casing and sealing temporary underground openings; right of entry requirements; surface drainage associated with auger mining; correcting reference errors; updating addresses; and correcting spelling and grammatical errors. Oklahoma intended to revise its program to be no less effective than the Federal regulations and to improve operational efficiency.", 2017-26843,https://www.federalregister.gov/documents/2017/12/13/2017-26843/oklahoma-regulatory-program,https://www.gpo.gov/fdsys/pkg/FR-2017-12-13/pdf/2017-26843.pdf,12/13/2017
Certificate of Release or Discharge From Active Duty (DD Form 214/5 Series),Rule,Defense Department; Office of the Secretary,"This final rule removes the DoD's regulation concerning the certificate of release or discharge from active duty (Department of Defense Form (DD Form) 214/5 Series). DoD has determined that the rule has no impact on the general public; rather, the rule focuses on internal DoD management and personnel matters. Therefore, this part is unnecessary and can be removed from the CFR.", 2017-26886,https://www.federalregister.gov/documents/2017/12/13/2017-26886/certificate-of-release-or-discharge-from-active-duty-dd-form-2145-series,https://www.gpo.gov/fdsys/pkg/FR-2017-12-13/pdf/2017-26886.pdf,12/13/2017
"Drawbridge Operation Regulation; Carquinez Strait, at Martinez, CA",Rule,Homeland Security Department; Coast Guard,"The Coast Guard has issued a temporary deviation from the operating schedule that governs the Benicia-Martinez Union Pacific Railroad Drawbridge across the Carquinez Strait, mile 7.0, at Martinez, CA. The deviation is necessary to allow the bridge owner to replace drawspan operational components. This deviation allows the bridge to remain in the closed-to-navigation position during the deviation period.", 2017-26768,https://www.federalregister.gov/documents/2017/12/13/2017-26768/drawbridge-operation-regulation-carquinez-strait-at-martinez-ca,https://www.gpo.gov/fdsys/pkg/FR-2017-12-13/pdf/2017-26768.pdf,12/13/2017
"Approval and Promulgation of Air Quality Implementation Plans; Pennsylvania; Adoption of Control Techniques Guidelines for Control of Volatile Organic Compound Emissions From Miscellaneous Metal Parts Surface Coating, Miscellaneous Plastic Parts Surface Coating, and Pleasure Craft Surface Coatings; Withdrawal of Direct Final Rule",Rule,Environmental Protection Agency,"Due to receipt of an adverse comment, the Environmental Protection Agency (EPA) is withdrawing the October 16, 2017 direct final rule (DFR) that approved a revision to the Commonwealth of Pennsylvania's state implementation plan (SIP). The revision included amendments to the Pennsylvania Department of Environmental Protection's (PADEP) regulations and addressed the requirement to adopt reasonably available control technology (RACT) for sources covered by EPA's control techniques guidelines (CTG) standards for the following categories: Miscellaneous metal parts surface coating, miscellaneous plastic parts surface coating, and pleasure craft surface coatings, as well as related cleaning activities. The SIP revision also amended regulations for graphic arts systems and mobile equipment repair and refinishing as well as made general administrative changes. EPA stated in the direct final rule that if EPA received adverse comments by November 15, 2017, the rule would be withdrawn and not take effect. EPA subsequently received adverse comments. EPA will address the comments received in a subsequent final action based upon the proposed action also published on October 16, 2017. EPA will not institute a second comment period on this action.", 2017-26764,https://www.federalregister.gov/documents/2017/12/13/2017-26764/approval-and-promulgation-of-air-quality-implementation-plans-pennsylvania-adoption-of-control,https://www.gpo.gov/fdsys/pkg/FR-2017-12-13/pdf/2017-26764.pdf,12/13/2017
Approval and Promulgation of Air Quality Implementation Plans; Pennsylvania; Pennsylvania's Adoption of Control Techniques Guidelines for Automobile and Light-Duty Truck Assembly Coatings; Withdrawal of Direct Final Rule,Rule,Environmental Protection Agency,"Due to receipt of adverse comment, the Environmental Protection Agency (EPA) is withdrawing the direct final rule published on Tuesday, October 24, 2017 to approve revisions to the Pennsylvania state implementation plan (SIP) pertaining to the addition of new regulations to address the requirement to adopt reasonably available control technology (RACT) for sources covered by EPA's control techniques guidelines (CTG) for automobile and light-duty truck assembly coatings.", 2017-26763,https://www.federalregister.gov/documents/2017/12/13/2017-26763/approval-and-promulgation-of-air-quality-implementation-plans-pennsylvania-pennsylvanias-adoption-of,https://www.gpo.gov/fdsys/pkg/FR-2017-12-13/pdf/2017-26763.pdf,12/13/2017
International Fisheries; Western and Central Pacific Fisheries for Highly Migratory Species; 2017 Purse Seine FAD Fishery Closure,Rule,Commerce Department; National Oceanic and Atmospheric Administration,"NMFS announces that U.S. purse seine vessels will be prohibited from fishing on fish aggregating devices (FADs) in the area of application of the Convention on the Conservation and Management of Highly Migratory Fish Stocks in the Western and Central Pacific Ocean (Convention) in the area between the latitudes of 20[deg] N. and 20[deg] S., as a result of reaching the 2017 limit on FAD sets. This action is taken to enable the United States to implement provisions of a conservation and management measure adopted by the Commission for the Conservation and Management of Highly Migratory Fish Stocks in the Western and Central Pacific Ocean (WCPFC or Commission) and to satisfy the obligations of the United States under the Convention, to which it is a Contracting Party.", 2017-26879,https://www.federalregister.gov/documents/2017/12/13/2017-26879/international-fisheries-western-and-central-pacific-fisheries-for-highly-migratory-species-2017,https://www.gpo.gov/fdsys/pkg/FR-2017-12-13/pdf/2017-26879.pdf,12/13/2017
Highly Erodible Land Conservation and Wetland Conservation; Conforming Amendment,Rule,Agriculture Department; Office of the Secretary,This final rule amends the United States Department of Agriculture regulations to conform to the changes regarding conservation compliance made by the Federal Crop Insurance Corporation (FCIC) to its regulations in Catastrophic Risk Protection Endorsement; Area Risk Protection Insurance Basic Provisions; and Common Crop Insurance Policy Basic Provisions. These changes will provide more flexibility for conservation compliance determinations; reduce burdens on policyholders; and will allow the conservation compliance certification process for crop insurance to be administered more consistently with the practices of the Farm Service Agency (FSA)., 2017-26736,https://www.federalregister.gov/documents/2017/12/12/2017-26736/highly-erodible-land-conservation-and-wetland-conservation-conforming-amendment,https://www.gpo.gov/fdsys/pkg/FR-2017-12-12/pdf/2017-26736.pdf,12/12/2017
"Amendment of Class E Airspace, Stevens Point, WI",Rule,Transportation Department; Federal Aviation Administration,"This action corrects a final rule published in the Federal Register of November 1, 2017 that modifies Class E airspace extending upward from 700 feet above the surface at Stevens Point Municipal Airport, Stevens Point, WI, to accommodate new standard instrument approach procedures for instrument flight rules operations at the airport. The FAA identified that the latitude coordinate was incorrect.", 2017-26656,https://www.federalregister.gov/documents/2017/12/12/2017-26656/amendment-of-class-e-airspace-stevens-point-wi,https://www.gpo.gov/fdsys/pkg/FR-2017-12-12/pdf/2017-26656.pdf,12/12/2017
Streamlining Administrative Regulations for Multifamily Housing Programs and Implementing Family Income Reviews Under the Fixing America's Surface Transportation (FAST) Act,Rule,Housing and Urban Development Department,"HUD published a final rule on March 8, 2016, containing changes to streamline regulatory requirements pertaining to certain elements of the Housing Choice Voucher (HCV), Public Housing (PH), and various multifamily housing (MFH) rental assistance programs. The goal of the final rule was to reduce the administrative burden on public housing agencies (PHAs) and MFH owners, including changes pertaining to annual income reviews in the HCV, PH, and Section 8 Project-Based Rental Assistance (PBRA) programs for families with sources of fixed income. On December 4, 2015, the President signed the Fixing America's Surface Transportation Act (FAST Act) into law. The law contained language that allowed PHAs and owners to conduct full income recertification for families with 90 percent or more of their income from fixed-income every 3 years instead of annually. This interim final rule amends the regulatory language to implement the FAST Act and to align the current regulatory flexibilities with those provided in the FAST Act. In addition, this interim final rule seeks to extend to certain MFH programs some of the streamlining changes that were proposed for and made only to the HCV and PH programs.", 2017-26697,https://www.federalregister.gov/documents/2017/12/12/2017-26697/streamlining-administrative-regulations-for-multifamily-housing-programs-and-implementing-family,https://www.gpo.gov/fdsys/pkg/FR-2017-12-12/pdf/2017-26697.pdf,12/12/2017
Approval and Promulgation of Air Quality Implementation Plans; West Virginia; Removal of Clean Air Interstate Rule Trading Programs Replaced by Cross-State Air Pollution Rule Trading Programs; Withdrawal of Direct Final Rule,Rule,Environmental Protection Agency,"Due to receipt of an adverse comment, the Environmental Protection Agency (EPA) is withdrawing the September 25, 2017 direct final rule that approved two state implementation plan (SIP) revisions submitted by the State of West Virginia removing the Clean Air Interstate Rule (CAIR) annual nitrogen oxide (NO<INF>X</INF>) and annual sulfur dioxide (SO<INF>2</INF>) trading programs from the West Virginia SIP.", 2017-26408,https://www.federalregister.gov/documents/2017/12/12/2017-26408/approval-and-promulgation-of-air-quality-implementation-plans-west-virginia-removal-of-clean-air,https://www.gpo.gov/fdsys/pkg/FR-2017-12-12/pdf/2017-26408.pdf,12/12/2017
Approval and Promulgation of Implementation Plans; New York; Reasonably Available Control Technology for the 2008 8-Hour Ozone National Ambient Air Quality Standards,Rule,Environmental Protection Agency,The Environmental Protection Agency (EPA) is conditionally approving a State Implementation Plan (SIP) submitted by the State of New York for purposes of implementing Reasonably Available Control Technology (RACT) for the 2008 8-hour ozone National Ambient Air Quality Standard (NAAQS) related to control of volatile organic compounds (VOCs) from industrial cleaning solvents. The EPA is approving New York's Ozone Transport Region RACT SIP as it applies to non-control technique guideline major sources of VOCs and major sources of oxides of nitrogen. The EPA is also approving the State of New York's state-wide non-attainment new source review certification as sufficient for purposes of satisfying the 2008 8-hour ozone NAAQS. The EPA is approving New York's certification that there are no sources within the State for the following CTGs: Manufacture of Vegetable Oils and Application of Agricultural Pesticides. This action is being taken in accordance with the requirements of the Clean Air Act., 2017-26657,https://www.federalregister.gov/documents/2017/12/12/2017-26657/approval-and-promulgation-of-implementation-plans-new-york-reasonably-available-control-technology,https://www.gpo.gov/fdsys/pkg/FR-2017-12-12/pdf/2017-26657.pdf,12/12/2017
Approval and Promulgation of Implementation Plans; New Mexico; Albuquerque and Bernalillo County; Regional Haze Progress Report State Implementation Plan,Rule,Environmental Protection Agency,"Pursuant to the Federal Clean Air Act (CAA or the Act), the Environmental Protection Agency (EPA) is approving a revision to a State Implementation Plan (SIP) for the City of Albuquerque and Bernalillo County, New Mexico (the County) submitted by the Governor on June 24, 2016. The SIP revision addresses requirements of the Act and the EPA's rules that require the County to submit a periodic report assessing reasonable progress goals (RPGs) for regional haze with a determination of the adequacy of the existing regional haze SIP.", 2017-26661,https://www.federalregister.gov/documents/2017/12/12/2017-26661/approval-and-promulgation-of-implementation-plans-new-mexico-albuquerque-and-bernalillo-county,https://www.gpo.gov/fdsys/pkg/FR-2017-12-12/pdf/2017-26661.pdf,12/12/2017
Federal Civil Penalties Adjustments,Rule,National Foundation on the Arts and the Humanities; National Endowment for the Arts,The National Endowment for the Arts (NEA) is adjusting the maximum civil monetary penalties that may be imposed for violations of the Program Fraud Civil Remedies Act (PFCRA) and the NEA's Restrictions on Lobbying to reflect the requirements of the Federal Civil Penalties Inflation Adjustment Act Improvements Act of 2015 (the 2015 Act). The 2015 Act further amended the Federal Civil Penalties Inflation Adjustment Act of 1990 (the Inflation Adjustment Act) to improve the effectiveness of civil monetary penalties and to maintain their deterrent effect. This final rule finalizes the catch-up inflation adjustment interim final rule required by the Inflation Adjustment Act., 2017-26733,https://www.federalregister.gov/documents/2017/12/12/2017-26733/federal-civil-penalties-adjustments,https://www.gpo.gov/fdsys/pkg/FR-2017-12-12/pdf/2017-26733.pdf,12/12/2017
Department of State Acquisition Regulation; Technical Amendment,Rule,State Department,"The Department of State (DOS) is amending the Department of State Acquisition Regulation (DOSAR) to add notice that the Department has an agreement with the Defense Contract Audit Agency, and to provide a procedural correction.", 2017-26712,https://www.federalregister.gov/documents/2017/12/12/2017-26712/department-of-state-acquisition-regulation-technical-amendment,https://www.gpo.gov/fdsys/pkg/FR-2017-12-12/pdf/2017-26712.pdf,12/12/2017
Department of State Acquisition Regulation,Rule,State Department,The Department of State (DOS) is amending the Department of State Acquisition Regulation (DOSAR) to provide new guidance prescribing more stringent safety requirements for certain overseas construction and services projects., 2017-26711,https://www.federalregister.gov/documents/2017/12/12/2017-26711/department-of-state-acquisition-regulation,https://www.gpo.gov/fdsys/pkg/FR-2017-12-12/pdf/2017-26711.pdf,12/12/2017
Public Availability of Information,Rule,National Transportation Safety Board,"The NTSB is issuing an interim final rule that revises 49 CFR part 801, ``Public Availability of Information,'' to implement the substantive and procedural changes to the Freedom of Information Act (FOIA), identified in the Open Government Act of 2007, December 31, 2007, the Open FOIA Act of 2009, October 28, 2009, and the FOIA Improvement Act of 2016, June 30, 2016. These revisions to the NTSB FOIA regulation are being issued as an interim final rule to ensure that an updated regulation is in place as soon as practicable to implement the Acts referenced above.", 2017-26316,https://www.federalregister.gov/documents/2017/12/12/2017-26316/public-availability-of-information,https://www.gpo.gov/fdsys/pkg/FR-2017-12-12/pdf/2017-26316.pdf,12/12/2017
Renewable Fuel Standard Program: Standards for 2018 and Biomass-Based Diesel Volume for 2019,Rule,Environmental Protection Agency,"Under section 211 of the Clean Air Act, the Environmental Protection Agency (EPA) is required to set renewable fuel percentage standards every year. This action establishes the annual percentage standards for cellulosic biofuel, biomass-based diesel, advanced biofuel, and total renewable fuel that apply to gasoline and diesel transportation fuel produced or imported in the year 2018. Relying on statutory waiver authority that is available when projected cellulosic biofuel production volumes are less than the applicable volume specified in the statute, the EPA is establishing volume requirements for cellulosic biofuel, advanced biofuel, and total renewable fuel that are below the statutory volume targets. In this action, we are also establishing the applicable volume of biomass-based diesel for 2019.", 2017-26426,https://www.federalregister.gov/documents/2017/12/12/2017-26426/renewable-fuel-standard-program-standards-for-2018-and-biomass-based-diesel-volume-for-2019,https://www.gpo.gov/fdsys/pkg/FR-2017-12-12/pdf/2017-26426.pdf,12/12/2017
"Rules of Practice and Procedures To Formulate or Amend a Marketing Agreement, a Marketing Order, or Certain Research and Promotion Orders",Rule,Agriculture Department; Agricultural Marketing Service,"The Agricultural Marketing Service (AMS) of the United States Department of Agriculture (USDA) is adopting a final rule to amend the definition of ``judge'' in the rules of practice and procedure to formulate or amend a marketing agreement, marketing order, or certain research and promotion orders. The new definition adds a presiding official appointed by the Secretary, as well as an administrative law judge, as an official who may preside over the rulemaking hearing.", 2017-26718,https://www.federalregister.gov/documents/2017/12/11/2017-26718/rules-of-practice-and-procedures-to-formulate-or-amend-a-marketing-agreement-a-marketing-order-or,https://www.gpo.gov/fdsys/pkg/FR-2017-12-11/pdf/2017-26718.pdf,12/11/2017
