title,type,agency_names,abstract,document_number,html_url,pdf_url,publication_date
Fisheries of the Exclusive Economic Zone Off Alaska; Chinook Salmon Prohibited Species Catch Limits in the Gulf of Alaska,Rule,Commerce Department; National Oceanic and Atmospheric Administration,"NMFS is reapportioning the projected unused amount, 404 Chinook salmon prohibited species catch limit, from the vessels participating in directed fishing for pollock in the Central Regulatory area of the Gulf of Alaska (GOA) to vessels participating in directed fishing for pollock in the Western Regulatory area of the GOA. This action is necessary to provide opportunity for harvest of the 2017 pollock TAC, consistent with the goals and objectives of the Fishery Management Plan for Groundfish of the Gulf of Alaska.", 2017-25115,https://www.federalregister.gov/documents/2017/11/20/2017-25115/fisheries-of-the-exclusive-economic-zone-off-alaska-chinook-salmon-prohibited-species-catch-limits,https://www.gpo.gov/fdsys/pkg/FR-2017-11-20/pdf/2017-25115.pdf,11/20/2017
Same Surgical Procedure Exception: Questions and Answers Regarding the Scope of the Exception; Guidance for Industry; Availability,Rule,Health and Human Services Department; Food and Drug Administration,"The Food and Drug Administration (FDA or Agency) is announcing the availability of a document entitled ``Same Surgical Procedure Exception under 21 CFR 1271.15(b): Questions and Answers Regarding the Scope of the Exception.'' The guidance document provides tissue establishments and health care professionals with FDA's current thinking on the scope of an exception set forth in the human cells, tissues, and cellular and tissue-based products (HCT/Ps) regulations.", 2017-24839,https://www.federalregister.gov/documents/2017/11/17/2017-24839/same-surgical-procedure-exception-questions-and-answers-regarding-the-scope-of-the-exception,https://www.gpo.gov/fdsys/pkg/FR-2017-11-17/pdf/2017-24839.pdf,11/17/2017
"Regulatory Considerations for Human Cells, Tissues, and Cellular and Tissue-Based Products: Minimal Manipulation and Homologous Use; Guidance for Industry and Food and Drug Administration Staff; Availability",Rule,Health and Human Services Department; Food and Drug Administration,"The Food and Drug Administration (FDA or Agency) is announcing the availability of a document entitled ``Regulatory Considerations for Human Cells, Tissues, and Cellular and Tissue-Based Products: Minimal Manipulation and Homologous Use; Guidance for Industry and Food and Drug Administration Staff.'' The guidance provides human cells, tissues, and cellular and tissue-based product (HCT/P) manufacturers, healthcare providers, and FDA staff, with FDA's current thinking on the regulatory criteria of minimal manipulation and homologous use. The guidance is intended to improve stakeholders' understanding of the definitions of minimal manipulation and homologous use and how the regulatory criteria apply to their HCT/Ps. It also informs manufacturers, healthcare providers, and other interested persons that the Agency generally intends to exercise enforcement discretion over the next 36 months under limited conditions, with respect to the investigational new drug (IND) application and premarket approval (biologics license application (BLA)) requirements, for certain HCT/Ps.", 2017-24838,https://www.federalregister.gov/documents/2017/11/17/2017-24838/regulatory-considerations-for-human-cells-tissues-and-cellular-and-tissue-based-products-minimal,https://www.gpo.gov/fdsys/pkg/FR-2017-11-17/pdf/2017-24838.pdf,11/17/2017
Texas Regulatory Program,Rule,Interior Department; Surface Mining Reclamation and Enforcement Office,"We, the Office of Surface Mining Reclamation and Enforcement (OSMRE), are approving an amendment to the Texas regulatory program (Texas program) under the Surface Mining Control and Reclamation Act of 1977 (SMCRA or the Act). Texas proposed revisions to its regulations regarding annual permit fees. Texas revised its program at its own initiative to raise revenues sufficient to cover its anticipated share of costs to administer the coal regulatory program and to encourage mining companies to more quickly reclaim lands and request bond release, thereby fulfilling SMCRA's purpose of assuring the reclamation of mined land as quickly as possible.", 2017-24620,https://www.federalregister.gov/documents/2017/11/17/2017-24620/texas-regulatory-program,https://www.gpo.gov/fdsys/pkg/FR-2017-11-17/pdf/2017-24620.pdf,11/17/2017
VA Vocational Rehabilitation and Employment Nomenclature Change for Position Title-Revision,Rule,Veterans Affairs Department,"The Department of Veterans Affairs (VA) published a final rule in the Federal Register on May 2, 2016, which amended a number of regulations in the Code of Federal Regulations (CFR) to authorize personnel hired by VA's Vocational Rehabilitation and Employment (VR&E) Service under the title ``Vocational Rehabilitation Counselor'' (VRC) to make the same determinations with respect to Chapter 31 services and benefits as personnel who had been hired under the title ``Counseling Psychologist'' (CP). The preamble to that final rule cited supporting documents inaccurately and failed to properly explain the qualifications for and duties of this VR&E position responsible for making determinations with respect to Chapter 31 services and benefits. This interim final rule corrects those inaccuracies, more clearly explains the basis for the final rule, and invites public comment on the changes made to VA's regulations in the May 2, 2016, final rule.", 2017-24949,https://www.federalregister.gov/documents/2017/11/17/2017-24949/va-vocational-rehabilitation-and-employment-nomenclature-change-for-position-title-revision,https://www.gpo.gov/fdsys/pkg/FR-2017-11-17/pdf/2017-24949.pdf,11/17/2017
Approval and Promulgation of Air Quality Implementation Plans; Maryland; 2011 Base Year Inventory for the 2008 8-Hour Ozone National Ambient Air Quality Standard for the Maryland Portion of the Philadelphia-Wilmington-Atlantic City Nonattainment Area; Withdrawal,Rule,Environmental Protection Agency,"Due to the receipt of an adverse comment, the Environmental Protection Agency (EPA) is withdrawing the September 25, 2017 direct final rule that approved the 2011 base year inventory for the Maryland portion of the Philadelphia-Wilmington-Atlantic City marginal nonattainment area for the 2008 8-hour ozone national ambient air quality standard (NAAQS). EPA stated in the direct final rule that if EPA received adverse comments by October 25, 2017, the rule would be withdrawn and not take effect. EPA subsequently received an adverse comment. EPA will address the comment received in a subsequent final action based upon the proposed action also published on September 25, 2017. EPA will not institute a second comment period on this action.", 2017-24885,https://www.federalregister.gov/documents/2017/11/17/2017-24885/approval-and-promulgation-of-air-quality-implementation-plans-maryland-2011-base-year-inventory-for,https://www.gpo.gov/fdsys/pkg/FR-2017-11-17/pdf/2017-24885.pdf,11/17/2017
Air Quality Implementation Plans; Nebraska; Infrastructure SIP Requirements for the 2010 Nitrogen Dioxide and Sulfur Dioxide and the 2012 Fine Particulate Matter National Ambient Air Quality Standards; Withdrawal,Rule,Environmental Protection Agency,"Due to adverse comments, the Environmental Protection Agency (EPA) is withdrawing the direct final rule Approval of Nebraska Air Quality Implementation Plans; Infrastructure SIP Requirements for the 2010 Nitrogen Dioxide and Sulfur Dioxide and the 2012 Fine Particulate Matter National Ambient Air Quality Standards, published in the Federal Register on September 20, 2017. The direct final rule approved elements of a State Implementation Plan (SIP) submission from the State of Nebraska addressing the applicable requirements of Clean Air Act (CAA) section 110 for the 2010 Nitrogen Dioxide (NO<INF>2</INF>) and Sulfur Dioxide (SO<INF>2</INF>) National Ambient Air Quality Standards (NAAQS), and the 2012 Fine Particulate Matter (PM<INF>2.5</INF>) NAAQS. Section 110 of the CAA requires that each state adopt and submit a SIP to support implementation, maintenance, and enforcement of each new or revised NAAQS promulgated by EPA. These SIPs are commonly referred to as ``infrastructure'' SIPs.", 2017-24893,https://www.federalregister.gov/documents/2017/11/17/2017-24893/air-quality-implementation-plans-nebraska-infrastructure-sip-requirements-for-the-2010-nitrogen,https://www.gpo.gov/fdsys/pkg/FR-2017-11-17/pdf/2017-24893.pdf,11/17/2017
State of Iowa; Elements of the Infrastructure SIP Requirements for the 2010 Nitrogen Dioxide National Ambient Air Quality Standard (NAAQS) Withdrawal,Rule,Environmental Protection Agency,"Due to an adverse comment, the Environmental Protection Agency (EPA) is withdrawing the direct final rule for Approval of Implementation Plans; State of Iowa; Elements of the Infrastructure SIP Requirements for the 2010 Nitrogen Dioxide National Ambient Air Quality Standard (NAAQS) published in the Federal Register on September 20, 2017. Infrastructure SIPs address the applicable requirements of Clean Air Act (CAA) section 110, which requires that each state adopt and submit a SIP for the implementation, maintenance, and enforcement of each new or revised NAAQS promulgated by the EPA. These SIPs are commonly referred to as ``infrastructure'' SIPs. The infrastructure requirements are designed to ensure that the structural components of each state's air quality management program are adequate to meet the state's responsibilities under the CAA.", 2017-24891,https://www.federalregister.gov/documents/2017/11/17/2017-24891/state-of-iowa-elements-of-the-infrastructure-sip-requirements-for-the-2010-nitrogen-dioxide-national,https://www.gpo.gov/fdsys/pkg/FR-2017-11-17/pdf/2017-24891.pdf,11/17/2017
Approval of Implementation Plans; State of Iowa; Elements of the Infrastructure SIP Requirements for the 2010 Sulfur Dioxide National Ambient Air Quality Standard (NAAQS); Withdrawal,Rule,Environmental Protection Agency,"Due to an adverse comment, the Environmental Protection Agency (EPA) is withdrawing the direct final rule for Approval of Implementation Plans; State of Iowa; Elements of the Infrastructure SIP Requirements for the 2010 Sulfur Dioxide National Ambient Air Quality Standard (NAAQS) published in the Federal Register on September 29, 2017. Infrastructure SIPs address the applicable requirements of Clean Air Act (CAA) section 110, which requires that each state adopt and submit a SIP for the implementation, maintenance, and enforcement of each new or revised NAAQS promulgated by the EPA. These SIPs are commonly referred to as ``infrastructure'' SIPs. The infrastructure requirements are designed to ensure that the structural components of each state's air quality management program are adequate to meet the state's responsibilities under the CAA.", 2017-24903,https://www.federalregister.gov/documents/2017/11/17/2017-24903/approval-of-implementation-plans-state-of-iowa-elements-of-the-infrastructure-sip-requirements-for,https://www.gpo.gov/fdsys/pkg/FR-2017-11-17/pdf/2017-24903.pdf,11/17/2017
Approval of Kansas Air Quality State Implementation Plans; Construction Permits and Approvals Program; Withdrawal,Rule,Environmental Protection Agency,"Due to an adverse comment, the Environmental Protection Agency (EPA) is withdrawing the direct final rule for Approval of Kansas Air Quality State Implementation Plans; Construction Permits and Approvals Program, published in the Federal Register on September 21, 2017. Kansas's SIP revisions included revisions to Kansas' construction permit rules. Specifically, these revisions implemented the revised National Ambient Air Quality Standard (NAAQS) for fine particulate matter; clarified and refined applicable criteria for sources subject to the construction permitting program; updated the construction permitting program fee structure and schedule; and made minor revisions and corrections.", 2017-24894,https://www.federalregister.gov/documents/2017/11/17/2017-24894/approval-of-kansas-air-quality-state-implementation-plans-construction-permits-and-approvals-program,https://www.gpo.gov/fdsys/pkg/FR-2017-11-17/pdf/2017-24894.pdf,11/17/2017
Approval and Promulgation of Air Quality Implementation Plans; Maryland; Direct Final Rule for the Approval of an Alternative Volatile Organic Compound Emission Standard; Withdrawal,Rule,Environmental Protection Agency,"Due to adverse comments received, the Environmental Protection Agency (EPA) is withdrawing the August 28, 2017 direct final rule that approved a revision to the Maryland state implementation plan (SIP) to incorporate by reference a Maryland Department of the Environment (MDE) order that establishes an alternative volatile organic compound (VOC) emission standard for National Gypsum Company (NGC) to ensure that it remains a minor VOC source. EPA stated in the direct final rule that if EPA received adverse comments by September 27, 2017, the rule would be withdrawn and not take effect. EPA subsequently received one adverse comment. EPA will address the comment received in a subsequent final action based upon the proposed action also published on August 28, 2017. EPA will not institute a second comment period on this action.", 2017-24889,https://www.federalregister.gov/documents/2017/11/17/2017-24889/approval-and-promulgation-of-air-quality-implementation-plans-maryland-direct-final-rule-for-the,https://www.gpo.gov/fdsys/pkg/FR-2017-11-17/pdf/2017-24889.pdf,11/17/2017
"Television Broadcasting Services; Anchorage, Alaska",Rule,Federal Communications Commission,"The Commission grants the request by Gray Television License, LLC (Gray) to substitute channel 7 for channel 5 for station KYES-TV, Anchorage, Alaska. Gray filed comments reaffirming its interest in the proposed channel substitution and stating that if the proposal is granted, it will promptly file an application for the facilities specified in the rulemaking petition and construct the station. As Gray explained in its petition, the antenna currently used by KYES-TV is a repurposed analog antenna the previous station owner built which provides an inefficient signal. In addition, the current remote transmission site does not have a generator and KYES-TV goes silent when there is a power outage. By moving to sister station KTUU's location, and operating with an existing modern broadband antenna on a high-VHF channel, the station will be able to deliver an improved signal. Gray will also add the KYES-TV signal to the translator network used by KTUU, which will reduce most of the loss of service that would result from the proposed move, which will serve the public interest.", 2017-24944,https://www.federalregister.gov/documents/2017/11/17/2017-24944/television-broadcasting-services-anchorage-alaska,https://www.gpo.gov/fdsys/pkg/FR-2017-11-17/pdf/2017-24944.pdf,11/17/2017
"Payday, Vehicle Title, and Certain High-Cost Installment Loans",Rule,Consumer Financial Protection Bureau,"The Bureau of Consumer Financial Protection (Bureau or CFPB) is issuing this final rule establishing regulations creating consumer protections for certain consumer credit products and the official interpretations to the rule. First, the rule identifies it as an unfair and abusive practice for a lender to make covered short-term or longer- term balloon-payment loans, including payday and vehicle title loans, without reasonably determining that consumers have the ability to repay the loans according to their terms. The rule exempts certain loans from the underwriting criteria prescribed in the rule if they have specific consumer protections. Second, for the same set of loans along with certain other high-cost longer-term loans, the rule identifies it as an unfair and abusive practice to make attempts to withdraw payment from consumers' accounts after two consecutive payment attempts have failed, unless the consumer provides a new and specific authorization to do so. Finally, the rule prescribes notices to consumers before attempting to withdraw payments from their account, as well as processes and criteria for registration of information systems, for requirements to furnish and obtain information from them, and for compliance programs and record retention. The rule prohibits evasions and operates as a floor leaving State and local jurisdictions to adopt further regulatory measures (whether a usury limit or other protections) as appropriate to protect consumers.", 2017-21808,https://www.federalregister.gov/documents/2017/11/17/2017-21808/payday-vehicle-title-and-certain-high-cost-installment-loans,https://www.gpo.gov/fdsys/pkg/FR-2017-11-17/pdf/2017-21808.pdf,11/17/2017
Congressional Nullification of the Stream Protection Rule Under the Congressional Review Act,Rule,Interior Department; Surface Mining Reclamation and Enforcement Office,"By operation of the Congressional Review Act, the Stream Protection Rule shall be treated as if it had never taken effect. The Office of Surface Mining Reclamation and Enforcement issues this document to effect the removal of any amendments, deletions or other modifications made by the nullified rule, and the reversion to the text of the regulations in effect immediately prior to the effective date of the Stream Protection Rule.", 2017-24307,https://www.federalregister.gov/documents/2017/11/17/2017-24307/congressional-nullification-of-the-stream-protection-rule-under-the-congressional-review-act,https://www.gpo.gov/fdsys/pkg/FR-2017-11-17/pdf/2017-24307.pdf,11/17/2017
"Oranges, Grapefruit, Tangerines, and Pummelos Grown in Florida; Change in Size Requirements for Oranges",Rule,Agriculture Department; Agricultural Marketing Service,"This rule implements a recommendation from the Citrus Administrative Committee (Committee) to relax the minimum size requirements currently prescribed under the marketing Order for oranges, grapefruit, tangerines, and pummelos grown in Florida (Order). The Committee locally administers the order and is comprised of growers and handlers operating within the production area and one public member. This rule relaxes the minimum size requirements for oranges from 2\8/16\ inches to 2\4/16\ inches in diameter. This rule will maximize shipments by allowing more oranges to be shipped to the fresh market and help reduce the losses sustained by the citrus industry during the September 2017 hurricane in Florida. This rule also contains a formatting change to subpart references to bring the Order language into conformance with Office of Federal Register's guidelines.", 2017-24701,https://www.federalregister.gov/documents/2017/11/16/2017-24701/oranges-grapefruit-tangerines-and-pummelos-grown-in-florida-change-in-size-requirements-for-oranges,https://www.gpo.gov/fdsys/pkg/FR-2017-11-16/pdf/2017-24701.pdf,11/16/2017
"Special Conditions: General Electric Company, GE9X Engine Models; Endurance Test Special Conditions",Rule,Transportation Department; Federal Aviation Administration,"These special conditions are issued for the General Electric Company turbofan engine models GE9X-105B1A, -105B1A1, -105B1A2, - 105B1A3, -102B1A, -102B1A1, -102B1A2, -102B1A3, and -93B1A. In these special conditions, the engine models will be referred to as ``GE9X.'' The engines will have novel or unusual design features associated with the engine design. The applicable airworthiness regulations do not contain adequate or appropriate safety standards for these design features. These special conditions contain the additional safety standards that the Administrator considers necessary to establish a level of safety equivalent to that established by the existing airworthiness standards.", 2017-24812,https://www.federalregister.gov/documents/2017/11/16/2017-24812/special-conditions-general-electric-company-ge9x-engine-models-endurance-test-special-conditions,https://www.gpo.gov/fdsys/pkg/FR-2017-11-16/pdf/2017-24812.pdf,11/16/2017
Offer Caps in Markets Operated by Regional Transmission Organizations and Independent System Operators,Rule,Energy Department; Federal Energy Regulatory Commission,"The Federal Energy Regulatory Commission is granting in part and denying in part requests for rehearing and clarification of its determinations in Order No. 831, which amended its regulations to address incremental energy offer caps in markets operated by regional transmission organizations and independent system operators.", 2017-24803,https://www.federalregister.gov/documents/2017/11/16/2017-24803/offer-caps-in-markets-operated-by-regional-transmission-organizations-and-independent-system,https://www.gpo.gov/fdsys/pkg/FR-2017-11-16/pdf/2017-24803.pdf,11/16/2017
Kentucky Regulatory Program,Rule,Interior Department; Surface Mining Reclamation and Enforcement Office,"We are approving an amendment to the Kentucky regulatory program (hereinafter, the ``Kentucky program'') under the Surface Mining Control and Reclamation Act of 1977 (SMCRA or the Act). Kentucky submitted a proposed amendment to OSMRE that includes revisions to the Kentucky Revised Statutes (KRS) as authorized by House Bill 385 (HB 385), regarding bonding of surface coal mining and reclamation operations.", 2017-24707,https://www.federalregister.gov/documents/2017/11/16/2017-24707/kentucky-regulatory-program,https://www.gpo.gov/fdsys/pkg/FR-2017-11-16/pdf/2017-24707.pdf,11/16/2017
"Special Local Regulation; Mavericks Surf Competition, Half Moon Bay, CA",Rule,Homeland Security Department; Coast Guard,"The Coast Guard is revising a special local regulation in the navigable waters of Half Moon Bay, CA, near Pillar Point in support of the Mavericks Surf Competition, an annual invitational surf competition held at the Mavericks Break. This revision is necessary to improve the regulation by making it clearer and to have it better reflect the natural conditions that must be met for this surf competition to take place. This regulation is necessary to provide for the safety of life on the navigable waters immediately prior to, during, and immediately after the surfing competition, which is held only one day between November 1 of each year and March 31 of the following year. This revision temporarily restricts vessel traffic in the vicinity of Pillar Point and prohibits vessels and persons not participating in or directly supporting the surfing event from entering the dedicated surfing area and a designated no-entry area.", 2017-24840,https://www.federalregister.gov/documents/2017/11/16/2017-24840/special-local-regulation-mavericks-surf-competition-half-moon-bay-ca,https://www.gpo.gov/fdsys/pkg/FR-2017-11-16/pdf/2017-24840.pdf,11/16/2017
"Safety Zones; Humboldt Bay Bar, Eureka, CA, Noyo River Entrance, Ft. Bragg, CA, and Crescent City Harbor Entrance Channel, Crescent City, CA",Rule,Homeland Security Department; Coast Guard,"The Coast Guard is establishing temporary safety zones in the navigable waters of the Humboldt Bay Entrance Channel, of Eureka, CA, Noyo River Entrance Channel, of Fort Bragg, CA, and Crescent City Harbor Entrance Channel, of Crescent City, CA to safeguard navigation safety during extreme environmental conditions. These safety zones are established to protect the safety of vessels transiting the areas from the dangers associated with extreme breaking surf and high wind conditions occurring in the Humboldt Bay Bar Channel, Noyo River Entrance Channel, and Crescent City Harbor Entrance Channels. When enforced, entry of persons or vessels into this temporary safety zone is prohibited unless specifically authorized by the Captain of the Port (COTP), San Francisco or his designated representative.", 2017-24842,https://www.federalregister.gov/documents/2017/11/16/2017-24842/safety-zones-humboldt-bay-bar-eureka-ca-noyo-river-entrance-ft-bragg-ca-and-crescent-city-harbor,https://www.gpo.gov/fdsys/pkg/FR-2017-11-16/pdf/2017-24842.pdf,11/16/2017
"Safety Zone; Annual Fireworks Display on the Ohio River, Monongahela River, Allegheny River, Pittsburgh, PA",Rule,Homeland Security Department; Coast Guard,"The Coast Guard will enforce the subject safety zone for the annual fireworks display that takes place every November on the Ohio River, Monongahela River and Allegheny River extending the entire width of the rivers. The zone is needed to protect vessels transiting the area and event spectators from the hazards associated with the fireworks display. During the enforcement period, entry into, transiting, or anchoring in the safety zone is prohibited to all vessels not registered with the sponsor as participants or official patrol vessels, unless specifically authorized by the Captain of the Port Marine Safety Unit Pittsburgh (COTP) or a designated representative.", 2017-24820,https://www.federalregister.gov/documents/2017/11/16/2017-24820/safety-zone-annual-fireworks-display-on-the-ohio-river-monongahela-river-allegheny-river-pittsburgh,https://www.gpo.gov/fdsys/pkg/FR-2017-11-16/pdf/2017-24820.pdf,11/16/2017
"Safety Zone; Atlantic Ocean, Rehoboth Beach, DE",Rule,Homeland Security Department; Coast Guard,"On November 9, 2017, the Coast Guard published a rule establishing temporary safety zones in the Atlantic Ocean, off the coast of Rehoboth Beach, DE and in Breakwater Harbor near Cape Henlopen. The rule was made enforceable from November 6, 2017, through February 28, 2018. However, in regulatory text the February date was mistakenly given as February 28, 2017. This document corrects that error.", 2017-24805,https://www.federalregister.gov/documents/2017/11/16/2017-24805/safety-zone-atlantic-ocean-rehoboth-beach-de,https://www.gpo.gov/fdsys/pkg/FR-2017-11-16/pdf/2017-24805.pdf,11/16/2017
