title,type,agency_names,abstract,document_number,html_url,pdf_url,publication_date
Civil Penalties; 2018 Inflation Adjustments for Civil Monetary Penalties,Rule,Interior Department; Fish and Wildlife Service,"The U.S. Fish and Wildlife Service (Service or we) is issuing this final rule, in accordance with the Federal Civil Penalties Inflation Adjustment Act Improvements Act of 2015 (Inflation Adjustment Act) and Office of Management and Budget (OMB) guidance, to adjust for inflation the statutory civil monetary penalties that may be assessed for violations of Service-administered statutes and their implementing regulations. We are required to adjust civil monetary penalties annually for inflation according to a formula specified in the Inflation Adjustment Act. This rule replaces the previously issued amounts with the updated amounts after using the 2018 inflation adjustment multiplier provided in the OMB guidance.", 2018-02769,https://www.federalregister.gov/documents/2018/02/12/2018-02769/civil-penalties-2018-inflation-adjustments-for-civil-monetary-penalties,https://www.gpo.gov/fdsys/pkg/FR-2018-02-12/pdf/2018-02769.pdf,02/12/2018
2017 Tribal Fishery Allocations for Pacific Whiting; Reapportionment Between Tribal and Non-Tribal Sectors; Widow Rockfish Reapportionment in the Pacific Whiting Fishery,Rule,Commerce Department; National Oceanic and Atmospheric Administration,"This document announces the reapportionment of 41,000 metric tons (mt) of Pacific whiting from the tribal allocation to the non- tribal commercial fishery sectors via automatic action on September 15, 2017, in order to allow full utilization of the Pacific whiting resource, and the reapportionment of 47 mt of widow rockfish in the Pacific whiting fishery via automatic action on August 30, 2017. The reapportionment of widow rockfish from the Mothership Cooperative to the Catcher Processor Cooperative was necessary to prevent the Catcher Processor Cooperative from reaching its quota for widow rockfish early, thereby closing the fishery before the end of the season and preventing attainment of their Pacific whiting allocation.", 2018-02752,https://www.federalregister.gov/documents/2018/02/12/2018-02752/2017-tribal-fishery-allocations-for-pacific-whiting-reapportionment-between-tribal-and-non-tribal,https://www.gpo.gov/fdsys/pkg/FR-2018-02-12/pdf/2018-02752.pdf,02/12/2018
Freedom of Information Act Implementation,Rule,Federal Housing Finance Agency,"The Federal Housing Finance Agency (FHFA) is finalizing its interim final rule that amended its Freedom of Information Act (FOIA) regulation. The amendments to FHFA's regulation incorporate the requirements of the FOIA Improvement Act of 2016 by giving notice of the circumstances under which FHFA may extend the time limit for responding to a FOIA request due to unusual circumstance; notifying a requester of their right to seek dispute resolution services; affording a requester a minimum of 90 days to file an administrative appeal; and clarifying and updating the existing regulation. The interim final rule became effective on March 15, 2017. This final rule finalizes the interim final rule with minor revisions for consistency and clarification.", 2018-02338,https://www.federalregister.gov/documents/2018/02/09/2018-02338/freedom-of-information-act-implementation,https://www.gpo.gov/fdsys/pkg/FR-2018-02-09/pdf/2018-02338.pdf,02/09/2018
Airworthiness Directives; The Boeing Company Airplanes,Rule,Transportation Department; Federal Aviation Administration,"We are adopting a new airworthiness directive (AD) for certain The Boeing Company Model 777-200, -200LR, -300, and -300ER series airplanes. This AD was prompted by reports of corrosion in the aft fuselage. This AD requires a one-time review of the operator's maintenance procedures, repetitive detailed internal and external inspections for corrosion or cracking, and applicable on-condition actions. This AD also includes an optional terminating action for the inspections. We are issuing this AD to address the unsafe condition on these products.", 2018-01807,https://www.federalregister.gov/documents/2018/02/09/2018-01807/airworthiness-directives-the-boeing-company-airplanes,https://www.gpo.gov/fdsys/pkg/FR-2018-02-09/pdf/2018-01807.pdf,02/09/2018
Airworthiness Directives; Airbus Airplanes,Rule,Transportation Department; Federal Aviation Administration,"We are superseding Airworthiness Directive (AD) 2012-12-12 and AD 2013-16-26, which applied to all Airbus Model A330-200, A330-200 Freighter, A330-300, A340-200, and A340-300 series airplanes. AD 2012- 12-12 required repetitive inspections of the outer skin rivets of the cargo doors, repair if necessary, and other repetitive inspections. AD 2013-16-26 required repetitive inspections of certain cargo doors, and repair if necessary. This new AD continues to require repetitive inspections, and repair if necessary. This new AD revises the applicability; adds a one-time inspection and adjustment of certain hook gaps; reinforcement of the door frame structure; related investigative and corrective actions if necessary; and a modification, which allows deferring reinforcement of the cargo door structure. This AD was prompted by a determination that a new inspection procedure is necessary to address the unsafe condition. We are issuing this AD to address the unsafe condition on these products.", 2018-01803,https://www.federalregister.gov/documents/2018/02/09/2018-01803/airworthiness-directives-airbus-airplanes,https://www.gpo.gov/fdsys/pkg/FR-2018-02-09/pdf/2018-01803.pdf,02/09/2018
"Airworthiness Directives; Rosemount Aerospace, Inc. Pitot Probes",Rule,Transportation Department; Federal Aviation Administration,"We are adopting a new airworthiness directive (AD) for Rosemount Aerospace Model 851AK pitot probes that were repaired by CSI Aerospace, Inc. between January 2013 and July 2014 that are installed on airplanes. This AD was prompted by a report that certain pitot probes are indicating the wrong airspeed during flight. This AD requires inspecting the airplane to determine the number of affected pitot probes installed and replacing the affected pitot probes. We are issuing this AD to address the unsafe condition on these products.", 2018-02550,https://www.federalregister.gov/documents/2018/02/09/2018-02550/airworthiness-directives-rosemount-aerospace-inc-pitot-probes,https://www.gpo.gov/fdsys/pkg/FR-2018-02-09/pdf/2018-02550.pdf,02/09/2018
"Establishment of Class E Airspace; Johnson City, TN",Rule,Transportation Department; Federal Aviation Administration,"This action establishes Class E airspace extending upward from 700 feet above the surface at Johnson City, TN, to accommodate new area navigation (RNAV) global positioning system (GPS) standard instrument approach procedures (SIAPs) serving Johnson City Medical Center Heliport. Controlled airspace is necessary for the safety and management of instrument flight rules (IFR) operations at the heliport.", 2018-02324,https://www.federalregister.gov/documents/2018/02/09/2018-02324/establishment-of-class-e-airspace-johnson-city-tn,https://www.gpo.gov/fdsys/pkg/FR-2018-02-09/pdf/2018-02324.pdf,02/09/2018
"Establishment of Class E Airspace, Spanish Fork, UT",Rule,Transportation Department; Federal Aviation Administration,"This action establishes Class E airspace extending upward from 700 feet above the surface, at Spanish Fork Airport Springville- Woodhouse Field, Spanish Fork, UT, to accommodate new area navigation (RNAV) procedures at the airport. This action ensures the safety and management of Instrument Flight Rules (IFR) operations within the National Airspace System.", 2018-02325,https://www.federalregister.gov/documents/2018/02/09/2018-02325/establishment-of-class-e-airspace-spanish-fork-ut,https://www.gpo.gov/fdsys/pkg/FR-2018-02-09/pdf/2018-02325.pdf,02/09/2018
"Amendment of Class D and E Airspace for the Following Missouri Towns; Cape Girardeau, MO; St. Louis, MO; and Macon, MO",Rule,Transportation Department; Federal Aviation Administration,"This action modifies Class D airspace at Spirit of St. Louis Airport, St. Louis, MO; Class E airspace designated as a surface area at Cape Girardeau Regional Airport, Cape Girardeau, MO, and Spirit of St. Louis Airport; Class E airspace designated as an extension at Cape Girardeau Regional Airport; and Class E airspace extending upward from 700 feet above the surface at Cape Girardeau Regional Airport, Spirit of St. Louis Airport, and Macon-Fower Memorial Airport, Macon, MO. Cancellation of standard instrument approach procedures at these airports prompted the FAA to conduct a review of the airspace. Additionally, the name of Cape Girardeau Regional Airport (formerly Cape Girardeau Municipal Airport) and the geographic coordinates of St. Louis Regional Airport; Alton/St. Louis, IL; the OBLIO Locator Outer Marker (LOM); and the Macon-Fower Memorial Airport are being adjusted to coincide with the FAA's aeronautical database. The airspace designation for Macon-Fower, MO, in Class E airspace extending upward from 700 feet above the surface is being removed as it is a duplicate entry of the Macon, MO, airspace designation.", 2018-02139,https://www.federalregister.gov/documents/2018/02/09/2018-02139/amendment-of-class-d-and-e-airspace-for-the-following-missouri-towns-cape-girardeau-mo-st-louis-mo,https://www.gpo.gov/fdsys/pkg/FR-2018-02-09/pdf/2018-02139.pdf,02/09/2018
"Revocation of Class E Airspace; Pulaski, WI",Rule,Transportation Department; Federal Aviation Administration,"This action removes Class E airspace extending upward from 700 feet above the surface at Carter Airport, Pulaski, WI. The FAA is proposing this action due to the cancellation of the instrument procedures into the airport, resulting in the airport no longer qualifying for controlled airspace.", 2018-02137,https://www.federalregister.gov/documents/2018/02/09/2018-02137/revocation-of-class-e-airspace-pulaski-wi,https://www.gpo.gov/fdsys/pkg/FR-2018-02-09/pdf/2018-02137.pdf,02/09/2018
Cyflufenamid; Pesticide Tolerances,Rule,Environmental Protection Agency,"This regulation establishes tolerances for residues of cyflufenamid in or on cherry crop subgroup 12-12A, hops dried cones, and fruiting vegetable crop group 8-10; and amends the tolerance for cucurbit vegetable crop group 9. Nisso America, on behalf of Nippon Soda Co., Ltd. requested these tolerances under the Federal Food, Drug, and Cosmetic Act (FFDCA).", 2018-02670,https://www.federalregister.gov/documents/2018/02/09/2018-02670/cyflufenamid-pesticide-tolerances,https://www.gpo.gov/fdsys/pkg/FR-2018-02-09/pdf/2018-02670.pdf,02/09/2018
Zoxamide; Pesticide Tolerances,Rule,Environmental Protection Agency,"This regulation establishes tolerances for residues of zoxamide in or on banana. Gowan Company, LLC requested these tolerances under the Federal Food, Drug, and Cosmetic Act (FFDCA).", 2018-02668,https://www.federalregister.gov/documents/2018/02/09/2018-02668/zoxamide-pesticide-tolerances,https://www.gpo.gov/fdsys/pkg/FR-2018-02-09/pdf/2018-02668.pdf,02/09/2018
Endangered and Threatened Wildlife and Plants; Endangered Species Status for Texas Hornshell,Rule,Interior Department; Fish and Wildlife Service,"We, the U.S. Fish and Wildlife Service (Service), determine endangered species status under the Endangered Species Act of 1973 (Act), as amended, for the Texas hornshell (Popenaias popeii), a freshwater mussel species from New Mexico, Texas, and Mexico. The effect of this regulation will be to add this species to the List of Endangered and Threatened Wildlife.", 2018-02672,https://www.federalregister.gov/documents/2018/02/09/2018-02672/endangered-and-threatened-wildlife-and-plants-endangered-species-status-for-texas-hornshell,https://www.gpo.gov/fdsys/pkg/FR-2018-02-09/pdf/2018-02672.pdf,02/09/2018
Fisheries of the Northeastern United States; Summer Flounder Fishery; Quota Transfer,Rule,Commerce Department; National Oceanic and Atmospheric Administration,"NMFS announces that the State of North Carolina is transferring a portion of its 2018 commercial summer flounder quota to the State of Rhode Island. This quota adjustment is necessary to comply with the Summer Flounder, Scup, and Black Sea Bass Fishery Management Plan quota transfer provisions. This announcement informs the public of the revised commercial quotas for North Carolina and Rhode Island.", 2018-02660,https://www.federalregister.gov/documents/2018/02/09/2018-02660/fisheries-of-the-northeastern-united-states-summer-flounder-fishery-quota-transfer,https://www.gpo.gov/fdsys/pkg/FR-2018-02-09/pdf/2018-02660.pdf,02/09/2018
Fisheries of the Exclusive Economic Zone Off Alaska; Pacific Cod by Non-American Fisheries Act Crab Vessels Operating as Catcher Vessels Using Pot Gear in the Central Regulatory Area of the Gulf of Alaska,Rule,Commerce Department; National Oceanic and Atmospheric Administration,"NMFS is prohibiting directed fishing for Pacific cod by non- American Fisheries Act (AFA) crab vessels that are subject to sideboard limits, and operating as catcher vessels (CVs) using pot gear, in the Central Regulatory Area of the Gulf of Alaska (GOA). This action is necessary to prevent exceeding the A season allowance of the 2018 Pacific cod sideboard limit established for non-AFA crab vessels that are operating as CVs using pot gear in the Central Regulatory Area of the GOA.", 2018-02614,https://www.federalregister.gov/documents/2018/02/09/2018-02614/fisheries-of-the-exclusive-economic-zone-off-alaska-pacific-cod-by-non-american-fisheries-act-crab,https://www.gpo.gov/fdsys/pkg/FR-2018-02-09/pdf/2018-02614.pdf,02/09/2018
Airworthiness Directives; 328 Support Services GmbH (Type Certificate Previously Held by AvCraft Aerospace GmbH; Fairchild Dornier GmbH; Dornier Luftfahrt GmbH) Airplanes,Rule,Transportation Department; Federal Aviation Administration,"We are adopting a new airworthiness directive (AD) for certain 328 Support Services GmbH Model 328-300 airplanes. This AD requires contacting the FAA to obtain instructions for addressing the unsafe condition on these products, and doing the actions specified in those instructions. This AD was prompted by a determination that incomplete inspection instructions exist for the skin under outer and inner doublers left installed after the removal of a certain data link system. We are issuing this AD to address the unsafe condition on these products.", 2018-02016,https://www.federalregister.gov/documents/2018/02/08/2018-02016/airworthiness-directives-328-support-services-gmbh-type-certificate-previously-held-by-avcraft,https://www.gpo.gov/fdsys/pkg/FR-2018-02-08/pdf/2018-02016.pdf,02/08/2018
"Amendment of Class E Airspace; Fort Scott, KS; and Phillipsburg, KS",Rule,Transportation Department; Federal Aviation Administration,"This action modifies Class E airspace extending upward from 700 feet above the surface at Fort Scott Municipal Airport, Fort Scott, KS, and Phillipsburg Municipal Airport, Phillipsburg, KS. This action is required due to the decommissioning of the Fort Scott non- directional radio beacon (NDB) and the Phillipsburg NDB, and the cancellation of the associated instrument approach procedures. This action enhances the safety and management of instrument flight rules (IFR) operations at these airports.", 2018-02136,https://www.federalregister.gov/documents/2018/02/08/2018-02136/amendment-of-class-e-airspace-fort-scott-ks-and-phillipsburg-ks,https://www.gpo.gov/fdsys/pkg/FR-2018-02-08/pdf/2018-02136.pdf,02/08/2018
Modification of Air Traffic Service (ATS) Routes; Western United States,Rule,Transportation Department; Federal Aviation Administration,This action modifies VOR Federal Airways V-113 and V-244 which caused navigational aid gaps due to the decommissioning of Manteca and Maxwell VORs., 2018-02133,https://www.federalregister.gov/documents/2018/02/08/2018-02133/modification-of-air-traffic-service-ats-routes-western-united-states,https://www.gpo.gov/fdsys/pkg/FR-2018-02-08/pdf/2018-02133.pdf,02/08/2018
Final 2020 Census Residence Criteria and Residence Situations,Rule,Commerce Department; Census Bureau,"The Bureau of the Census (U.S. Census Bureau) is providing notification of the Final 2020 Census Residence Criteria and Residence Situations. In addition, this document contains a summary of comments received in response to the June 30, 2016, Federal Register document, as well as the Census Bureau's responses to those comments. The residence criteria are used to determine where people are counted during each decennial census. Specific residence situations are included with the criteria to illustrate how the criteria are applied.", 2018-02370,https://www.federalregister.gov/documents/2018/02/08/2018-02370/final-2020-census-residence-criteria-and-residence-situations,https://www.gpo.gov/fdsys/pkg/FR-2018-02-08/pdf/2018-02370.pdf,02/08/2018
"Certifications and Exemptions Under the International Regulations for Preventing Collisions at Sea, 1972",Rule,Defense Department; Navy Department,"The Department of the Navy (DoN) is amending its certifications and exemptions under the International Regulations for Preventing Collisions at Sea, 1972 (72 COLREGS), to reflect that the Deputy Assistant Judge Advocate General (DAJAG) (Admiralty and Maritime Law) has determined that USS THOMAS HUDNER (DDG 116) is a vessel of the Navy which, due to its special construction and purpose, cannot fully comply with certain provisions of the 72 COLREGS without interfering with its special function as a naval ship . The intended effect of this rule is to warn mariners in waters where 72 COLREGS apply.", 2018-02554,https://www.federalregister.gov/documents/2018/02/08/2018-02554/certifications-and-exemptions-under-the-international-regulations-for-preventing-collisions-at-sea,https://www.gpo.gov/fdsys/pkg/FR-2018-02-08/pdf/2018-02554.pdf,02/08/2018
"Air Plan Approval; OR, Oakridge; PM2.5",Rule,Environmental Protection Agency,"The Environmental Protection Agency (EPA) is finalizing a finding of attainment by the attainment date and a clean data determination (CDD) for the Oakridge-Westfir (Oakridge), Oregon fine particulate matter nonattainment area (Oakridge NAA). The finding is based upon quality-assured, quality-controlled, and certified ambient air monitoring data showing the area has monitored attainment of the 2006 24-hour fine particulate matter (PM<INF>2.5</INF>) National Ambient Air Quality Standards (NAAQS) based on 2014-2016 data available in the EPA's Air Quality System (AQS) database. This determination will not constitute a redesignation to attainment. The EPA is also finalizing approval of the revisions to Oregon's State Implementation Plan (SIP) consisting of the updated Oakridge- Westfir PM<INF>2.5</INF> Attainment Plan (Oakridge Update) submitted by the Oregon Department of Environmental Quality (ODEQ) on January 20, 2017. The purpose of the Oakridge Update, developed by Lane Regional Air Protection Agency (LRAPA) in coordination with the ODEQ, is to provide an attainment demonstration of the 2006 24-hour PM<INF>2.5</INF> NAAQS and correct deficiencies in the 2012 Oakridge Attainment Plan.", 2018-02465,https://www.federalregister.gov/documents/2018/02/08/2018-02465/air-plan-approval-or-oakridge-pm25,https://www.gpo.gov/fdsys/pkg/FR-2018-02-08/pdf/2018-02465.pdf,02/08/2018
Approval and Promulgation of Air Quality Implementation Plans; West Virginia; Removal of Clean Air Interstate Rule Trading Programs Replaced by Cross-State Air Pollution Rule Trading Programs,Rule,Environmental Protection Agency,"The Environmental Protection Agency (EPA) is approving state implementation plan (SIP) revisions submitted by the State of West Virginia. These revisions pertain to two West Virginia regulations that established trading programs under the Clean Air Interstate Rule (CAIR). The EPA-administered trading programs under CAIR were discontinued on December 31, 2014 upon the implementation of the Cross- State Air Pollution Rule (CSAPR), which was promulgated by EPA to replace CAIR. CSAPR established federal trading programs for sources in multiple states, including West Virginia, that replace the CAIR state and federal trading programs. The submitted SIP revisions request removal of state regulations that implemented the CAIR annual nitrogen oxide (NO<INF>X</INF>) and annual sulfur dioxide (SO<INF>2</INF>) trading programs from the West Virginia SIP (as CSAPR has replaced CAIR). EPA is approving these SIP revisions in accordance with the requirements of the Clean Air Act (CAA). West Virginia's SIP revision submittal requesting removal of a state regulation that implemented the CAIR ozone season NO<INF>X</INF> trading program will be addressed in a separate action.", 2018-02463,https://www.federalregister.gov/documents/2018/02/08/2018-02463/approval-and-promulgation-of-air-quality-implementation-plans-west-virginia-removal-of-clean-air,https://www.gpo.gov/fdsys/pkg/FR-2018-02-08/pdf/2018-02463.pdf,02/08/2018
"Issuance of Guidance Memorandum, “Reclassification of Major Sources as Area Sources Under Section 112 of the Clean Air Act”",Rule,Environmental Protection Agency,The Environmental Protection Agency (EPA) is notifying the public that it has issued the guidance memorandum titled ``Reclassification of Major Sources as Area Sources Under Section 112 of the Clean Air Act''. The EPA is also withdrawing the memorandum titled ``Potential to Emit for MACT Standards--Guidance on Timing Issues.'', 2018-02331,https://www.federalregister.gov/documents/2018/02/08/2018-02331/issuance-of-guidance-memorandum-reclassification-of-major-sources-as-area-sources-under-section-112,https://www.gpo.gov/fdsys/pkg/FR-2018-02-08/pdf/2018-02331.pdf,02/08/2018
Deletion of Rules Made Obsolete by the Digital Television Transition,Rule,Federal Communications Commission,"In this document, the Federal Communications Commission (Commission) eliminates rules that have been made obsolete by the digital television transition.", 2018-02552,https://www.federalregister.gov/documents/2018/02/08/2018-02552/deletion-of-rules-made-obsolete-by-the-digital-television-transition,https://www.gpo.gov/fdsys/pkg/FR-2018-02-08/pdf/2018-02552.pdf,02/08/2018
Taking and Importing Marine Mammals; Taking Marine Mammals Incidental to Testing and Training Activities Conducted in the Eglin Gulf Test and Training Range in the Gulf of Mexico,Rule,Commerce Department; National Oceanic and Atmospheric Administration,"Upon application from the United States Air Force (USAF), 96th Civil Engineer Group/Environmental Planning Office (96 CEG/CEIEA) at Eglin Air Force Base (hereafter referred to as Eglin AFB), NMFS is issuing regulations under the Marine Mammal Protection Act (MMPA) for the taking of marine mammals incidental to conducting testing and training activities in the Eglin Gulf Test and Training Range (EGTTR) in the Gulf of Mexico over the course of five years. These regulations allow NMFS to issue a Letter of Authorization (LOA) for the incidental take of marine mammals during the specified testing and training activities carried out during the rule's period of effectiveness, set forth the permissible methods of taking, set forth other means of effecting the least practicable adverse impact on marine mammal species or stocks and their habitat, and set forth requirements pertaining to the monitoring and reporting of the incidental take. The specific activities are classified as military readiness activities.", 2018-02511,https://www.federalregister.gov/documents/2018/02/08/2018-02511/taking-and-importing-marine-mammals-taking-marine-mammals-incidental-to-testing-and-training,https://www.gpo.gov/fdsys/pkg/FR-2018-02-08/pdf/2018-02511.pdf,02/08/2018
Coastal Migratory Pelagic Resources of the Gulf of Mexico and Atlantic Region; Commercial Trip Limit Increase in the Atlantic Southern Zone,Rule,Commerce Department; National Oceanic and Atmospheric Administration,NMFS increases the commercial trip limit for king mackerel in or from Federal waters in an area off the Florida east coast between the border of Flagler and Volusia Counties and the border of Miami-Dade and Monroe Counties in the Atlantic southern zone to 75 fish per day. This commercial trip limit increase is necessary to maximize the socioeconomic benefits associated with harvesting the commercial quota of Atlantic migratory group king mackerel., 2018-02544,https://www.federalregister.gov/documents/2018/02/08/2018-02544/coastal-migratory-pelagic-resources-of-the-gulf-of-mexico-and-atlantic-region-commercial-trip-limit,https://www.gpo.gov/fdsys/pkg/FR-2018-02-08/pdf/2018-02544.pdf,02/08/2018
Airworthiness Directives; Airbus Airplanes,Rule,Transportation Department; Federal Aviation Administration,"We are superseding Airworthiness Directive (AD) 2005-19-28, which applied to certain Airbus Model A330-301, -321, -322, -341, and - 342 airplanes; and Model A340-200 and A340-300 series airplanes. AD 2005-19-28 required repetitive inspections for cracks in the aft face of the rear spar at the area adjacent to the bolt holes and the end of the build slot, and repair if necessary. AD 2005-19-28 also provided an optional terminating action for the repetitive inspections. This new AD was prompted by the results of a new fatigue and damage tolerance assessment, which determined that several compliance thresholds and intervals needed to be reduced. This AD requires contacting the FAA to obtain instructions for addressing the unsafe condition on these products, and doing the actions specified in those instructions. We are issuing this AD to address the unsafe condition on these products.", 2018-02352,https://www.federalregister.gov/documents/2018/02/07/2018-02352/airworthiness-directives-airbus-airplanes,https://www.gpo.gov/fdsys/pkg/FR-2018-02-07/pdf/2018-02352.pdf,02/07/2018
