title,type,agency_names,abstract,document_number,html_url,pdf_url,publication_date
"Hazardous, Restricted, and Perishable Mail (Publication 52); Incorporation by Reference",Rule,Postal Service,"The Postal Service announces the issuance of Hazardous, Restricted, and Perishable Mail (Publication 52) dated August 2017, and its incorporation by reference in the Code of Federal Regulations.", 2018-00266,https://www.federalregister.gov/documents/2018/01/10/2018-00266/hazardous-restricted-and-perishable-mail-publication-52-incorporation-by-reference,https://www.gpo.gov/fdsys/pkg/FR-2018-01-10/pdf/2018-00266.pdf,01/10/2018
Civil Monetary Penalty Inflation Adjustment Rule,Rule,Environmental Protection Agency,"The Environmental Protection Agency (EPA) is promulgating this final rule to adjust the level of statutory civil monetary penalty amounts under the statutes EPA administers. This action is mandated by the Federal Civil Penalties Inflation Adjustment Act of 1990, as amended through the Federal Civil Penalties Inflation Adjustment Act Improvements Act of 2015 (``the 2015 Act''). The 2015 Act prescribes a formula for annually adjusting statutory civil penalties to reflect inflation, maintain the deterrent effect of statutory civil penalties, and promote compliance with the law. The rule does not necessarily revise the penalty amounts that EPA chooses to seek pursuant to its civil penalty policies in a particular case. EPA's civil penalty policies, which guide enforcement personnel in how to exercise EPA's statutory penalty authorities, take into account a number of fact- specific considerations, e.g., the seriousness of the violation, the violator's good faith efforts to comply, any economic benefit gained by the violator as a result of its noncompliance, and a violator's ability to pay.", 2018-00287,https://www.federalregister.gov/documents/2018/01/10/2018-00287/civil-monetary-penalty-inflation-adjustment-rule,https://www.gpo.gov/fdsys/pkg/FR-2018-01-10/pdf/2018-00287.pdf,01/10/2018
Air Plan Approval; NC; Open Burning and Miscellaneous Revisions,Rule,Environmental Protection Agency,"Due to adverse comments received, the Environmental Protection Agency (EPA) is amending the North Carolina State Implementation Plan (SIP) to remove some provisions made effective through the direct final rule that was published on July 18, 2017. EPA stated that if adverse comments were received by the close of the comment period, the rule would be withdrawn and not take effect, or if adverse comments were received on an amendment, paragraph, or section of the rule, EPA may adopt as final those provisions of the rule that are not the subject of an adverse comment. EPA received adverse comments on two specific SIP revisions. Therefore, EPA is removing only the portions of the SIP related to those two revisions.", 2018-00028,https://www.federalregister.gov/documents/2018/01/10/2018-00028/air-plan-approval-nc-open-burning-and-miscellaneous-revisions,https://www.gpo.gov/fdsys/pkg/FR-2018-01-10/pdf/2018-00028.pdf,01/10/2018
Determination To Defer Sanctions; Arizona Department of Environmental Quality; PM2.5,Rule,Environmental Protection Agency,"The Environmental Protection Agency (EPA) is making an interim final determination that the State of Arizona has corrected a deficiency in its Clean Air Act (CAA or Act) state implementation plan (SIP) provisions concerning air permitting. Specifically, based on a proposed conditional approval published elsewhere in this Federal Register, and based on a prior proposed approval, previously published in the Federal Register, EPA is making an interim final determination that the State of Arizona (State) has satisfied the requirements of part D of the CAA permitting program for areas under the jurisdiction of the Arizona Department of Environmental Quality (ADEQ) with respect to fine particular matter (PM<INF>2.5</INF>) precursors. The effect of this interim final determination that the State has corrected the deficiency in the permitting program is that the imposition of sanctions that were triggered by a previous limited disapproval action by EPA in 2016 is now deferred. If the State meets its commitment that is the basis for the conditional approval, relief from these sanctions will become permanent upon the EPA's full approval of the State submission. If the EPA determines that the State has not met its commitment and the conditional approval is converted to a disapproval, these sanctions will no longer be deferred.", 2018-00030,https://www.federalregister.gov/documents/2018/01/10/2018-00030/determination-to-defer-sanctions-arizona-department-of-environmental-quality-pm25,https://www.gpo.gov/fdsys/pkg/FR-2018-01-10/pdf/2018-00030.pdf,01/10/2018
IFR Altitudes; Miscellaneous Amendments,Rule,Transportation Department; Federal Aviation Administration,"This amendment adopts miscellaneous amendments to the required IFR (instrument flight rules) altitudes and changeover points for certain Federal airways, jet routes, or direct routes for which a minimum or maximum en route authorized IFR altitude is prescribed. This regulatory action is needed because of changes occurring in the National Airspace System. These changes are designed to provide for the safe and efficient use of the navigable airspace under instrument conditions in the affected areas.", 2018-00130,https://www.federalregister.gov/documents/2018/01/09/2018-00130/ifr-altitudes-miscellaneous-amendments,https://www.gpo.gov/fdsys/pkg/FR-2018-01-09/pdf/2018-00130.pdf,01/09/2018
Reimbursement for Emergency Treatment,Rule,Veterans Affairs Department,"The Department of Veterans Affairs (VA) revises its regulations concerning payment or reimbursement for emergency treatment for non-service-connected conditions at non-VA facilities to implement the requirements of a recent court decision. Specifically, this rulemaking expands eligibility for payment or reimbursement to include veterans who receive partial payment from a health-plan contract for non-VA emergency treatment and establishes a corresponding reimbursement methodology. This rulemaking also expands the eligibility criteria for veterans to receive payment or reimbursement for emergency transportation associated with the emergency treatment, in order to ensure that veterans are adequately covered when emergency transportation is a necessary part of their non-VA emergency treatment.", 2018-00232,https://www.federalregister.gov/documents/2018/01/09/2018-00232/reimbursement-for-emergency-treatment,https://www.gpo.gov/fdsys/pkg/FR-2018-01-09/pdf/2018-00232.pdf,01/09/2018
"eInduction Option, Seamless Acceptance Program, and Full-Service Automation Option, Verification Standards",Rule,Postal Service,"The Postal Service is amending Mailing Standards of the United States Postal Service, Domestic Mail Manual (DMM[supreg]), to add verification standards for the eInduction Option, Seamless Acceptance Program, and Full-Service Automation Option.", 2018-00005,https://www.federalregister.gov/documents/2018/01/09/2018-00005/einduction-option-seamless-acceptance-program-and-full-service-automation-option-verification,https://www.gpo.gov/fdsys/pkg/FR-2018-01-09/pdf/2018-00005.pdf,01/09/2018
"Approval of Nevada Air Plan Revisions, Washoe Oxygenated Fuels Program",Rule,Environmental Protection Agency,The Environmental Protection Agency (EPA) is taking final action to approve a revision to the Nevada State Implementation Plan (SIP). This revision concerns emissions of carbon monoxide (CO) from passenger vehicles. We are approving the suspension of a local rule that regulated these emission sources under the Clean Air Act (CAA or the Act)., 2018-00027,https://www.federalregister.gov/documents/2018/01/09/2018-00027/approval-of-nevada-air-plan-revisions-washoe-oxygenated-fuels-program,https://www.gpo.gov/fdsys/pkg/FR-2018-01-09/pdf/2018-00027.pdf,01/09/2018
Air Plan Approval; Rhode Island; Enhanced Motor Vehicle Inspection and Maintenance Program; Withdrawal of Direct Final Rule,Rule,Environmental Protection Agency,"Due to the receipt of an adverse comment, the Environmental Protection Agency (EPA) is withdrawing the November 14, 2017 direct final rule approving a State Implementation Plan (SIP) revision submitted by the State of Rhode Island. Rhode Island's SIP revision updates the enhanced motor vehicle inspection and maintenance (I/M) program in Rhode Island. This action is being taken in accordance with the Clean Air Act.", 2018-00134,https://www.federalregister.gov/documents/2018/01/09/2018-00134/air-plan-approval-rhode-island-enhanced-motor-vehicle-inspection-and-maintenance-program-withdrawal,https://www.gpo.gov/fdsys/pkg/FR-2018-01-09/pdf/2018-00134.pdf,01/09/2018
Oklahoma: Final Approval of State Underground Storage Tank Program Revisions and Incorporation by Reference,Rule,Environmental Protection Agency,"Pursuant to the Resource Conservation and Recovery Act (RCRA or Act), the Environmental Protection Agency (EPA) is taking direct final action to approve revisions to the State of Oklahoma's Underground Storage Tank (UST) program submitted by the State. EPA has determined that these revisions satisfy all requirements needed for program approval. This action also codifies EPA's approval of Oklahoma's state program and incorporates by reference those provisions of the State regulations that we have determined meet the requirements for approval. The provisions will be subject to EPA's inspection and enforcement authorities under sections 9005 and 9006 of RCRA subtitle I and other applicable statutory and regulatory provisions.", 2018-00039,https://www.federalregister.gov/documents/2018/01/09/2018-00039/oklahoma-final-approval-of-state-underground-storage-tank-program-revisions-and-incorporation-by,https://www.gpo.gov/fdsys/pkg/FR-2018-01-09/pdf/2018-00039.pdf,01/09/2018
Amendment of the Commission's Rules With Regard to Operation in the 3550-3650 MHz Band,Rule,Federal Communications Commission,"The Federal Communications Commission (Commission) is announcing that three final rules that appeared in the Federal Register as part of the Commission's rulemaking Commercial Operations in the 3550-3650 MHz Band do not need information collection approval from the Office of Management and Budget (OMB) and are effective immediately. This document is consistent with the First Report and Order and Second Report and Order, which stated that the Commission would publish a document in the Federal Register announcing OMB approval and the effective date of these rules.", 2018-00190,https://www.federalregister.gov/documents/2018/01/09/2018-00190/amendment-of-the-commissions-rules-with-regard-to-operation-in-the-3550-3650-mhz-band,https://www.gpo.gov/fdsys/pkg/FR-2018-01-09/pdf/2018-00190.pdf,01/09/2018
Civil Monetary Penalties-2018 Adjustment,Rule,Surface Transportation Board,"The Surface Transportation Board (Board) is issuing a final rule to implement the annual inflationary adjustment to its civil monetary penalties, pursuant to the Federal Civil Penalties Inflation Adjustment Act Improvements Act of 2015.", 2018-00166,https://www.federalregister.gov/documents/2018/01/09/2018-00166/civil-monetary-penalties-2018-adjustment,https://www.gpo.gov/fdsys/pkg/FR-2018-01-09/pdf/2018-00166.pdf,01/09/2018
Air Quality Designations for the 2010 Sulfur Dioxide (SO2,Rule,Environmental Protection Agency,"This final rule establishes the initial air quality designations for certain areas in the United States (U.S.) for the 2010 sulfur dioxide (SO<INF>2</INF>) primary National Ambient Air Quality Standard (NAAQS). The Environmental Protection Agency (EPA) is designating the areas as either Nonattainment, Attainment/ Unclassifiable, or Unclassifiable. The designations are based on application of the EPA's nationwide analytical approach and technical analysis, including evaluation of monitoring data and air quality modeling, to determine the appropriate designation based on the weight of evidence for each area. The Clean Air Act (CAA or Act) directs areas designated Nonattainment by this rule to undertake certain planning and pollution control activities to attain the SO<INF>2</INF> NAAQS as expeditiously as practicable. This is the third of four expected sets of actions to designate areas of the U.S. for the 2010 SO<INF>2</INF> NAAQS.", 2017-28423,https://www.federalregister.gov/documents/2018/01/09/2017-28423/air-quality-designations-for-the-2010-sulfur-dioxide-so2,https://www.gpo.gov/fdsys/pkg/FR-2018-01-09/pdf/2017-28423.pdf,01/09/2018
Regulatory Capital Rules; Correction,Rule,Federal Reserve System,"The Board of Governors of the Federal Reserve System (Board) published a final rule in the Federal Register on October 11, 2013, regarding Regulatory Capital Rules. This publication corrects a typographical error in those rules whereby a transition provision was unintentionally deleted. The Board also published inconsistent amendments to Regulation Q in final rules published in the Federal Register on May 1, 2014, and August 14, 2015, that pertain to firms identified as global systemically important bank holding companies (GSIBs). This publication resolves these inconsistencies.", 2018-00062,https://www.federalregister.gov/documents/2018/01/08/2018-00062/regulatory-capital-rules-correction,https://www.gpo.gov/fdsys/pkg/FR-2018-01-08/pdf/2018-00062.pdf,01/08/2018
Civil Monetary Penalty Adjustments for Inflation,Rule,Commerce Department; Office of the Secretary,"This final rule is being issued to adjust for inflation each civil monetary penalty (CMP) provided by law within the jurisdiction of the United States Department of Commerce (Department of Commerce). The Federal Civil Penalties Inflation Adjustment Act of 1990, as amended by the Debt Collection Improvement Act of 1996 and the Federal Civil Penalties Inflation Adjustment Act Improvements Act of 2015, required the head of each agency to adjust for inflation its CMP levels in effect as of November 2, 2015, under a revised methodology that was effective for 2016 which provided for initial catch up adjustments for inflation in 2016, and requires adjustments for inflation to CMPs under a revised methodology for each year thereafter. The 2017 adjustments for inflation to CMPs to the Department of Commerce's CMPs were published in the Federal Register on December 28, 2016 and became effective January 15, 2017. The revised annual methodology provides for the improvement of the effectiveness of CMPs and to maintain their deterrent effect. Agencies' annual adjustments for inflation to CMPs shall take effect not later than January 15. The Department of Commerce's 2018 adjustments for inflation to CMPs apply only to CMPs with a dollar amount, and will not apply to CMPs written as functions of violations. The Department of Commerce's 2018 adjustments for inflation to CMPs apply only to those CMPs, including those whose associated violation predated such adjustment, which are assessed by the Department of Commerce after the effective date of the new CMP level.", 2017-28230,https://www.federalregister.gov/documents/2018/01/08/2017-28230/civil-monetary-penalty-adjustments-for-inflation,https://www.gpo.gov/fdsys/pkg/FR-2018-01-08/pdf/2017-28230.pdf,01/08/2018
"Revisions, Clarifications, and Technical Corrections to the Export Administration Regulations; Correction",Rule,Commerce Department; Industry and Security Bureau,"In this final rule, the Bureau of Industry and Security corrects an error in the text of Export Control Classification Numbers (ECCNs) 0D606, 0E606, and 8A609.", 2018-00059,https://www.federalregister.gov/documents/2018/01/08/2018-00059/revisions-clarifications-and-technical-corrections-to-the-export-administration-regulations,https://www.gpo.gov/fdsys/pkg/FR-2018-01-08/pdf/2018-00059.pdf,01/08/2018
Extension of Sunset Date for Attorney Advisor Program,Rule,Social Security Administration,"We are extending for six months our rule authorizing attorney advisors to conduct certain prehearing proceedings and to issue fully favorable decisions. The current rule is scheduled to expire on February 5, 2018. In this final rule, we are extending the sunset date to August 3, 2018. We are making no other substantive changes.", 2018-00058,https://www.federalregister.gov/documents/2018/01/08/2018-00058/extension-of-sunset-date-for-attorney-advisor-program,https://www.gpo.gov/fdsys/pkg/FR-2018-01-08/pdf/2018-00058.pdf,01/08/2018
Public Notification Requirements for Combined Sewer Overflows to the Great Lakes Basin,Rule,Environmental Protection Agency,"The Environmental Protection Agency (EPA) is finalizing a rule to implement section 425 of the Consolidated Appropriations Act of 2016, which requires EPA to work with the Great Lakes States to establish public notification requirements for combined sewer overflow (CSO) discharges to the Great Lakes. The requirements address signage, notification of local public health departments and other potentially affected public entities, notification to the public, and annual notice. The rule includes a two-stage approach with requirements that apply directly to existing National Pollutant Discharge Elimination System (NPDES) permittees authorized to discharge from a CSO to the Great Lakes Basin, beginning on August 7, 2018 and a requirement that the public notification provisions be incorporated into NPDES permits when these permits are issued or reissued after February 7, 2018, unless the permit has been proposed prior to February 7, 2018 in which case the requirements would be incorporated into the next permit renewal. This rule protects public health by ensuring timely notification to the public and to public health departments, public drinking water facilities and other potentially affected public entities, including Indian tribes. It provides additional specificity beyond existing public notification requirements to ensure timely and consistent communication to the public regarding CSO discharges to the Great Lakes Basin. Timely notice may allow the public and affected public entities to take steps to reduce the public's potential exposure to pathogens associated with human sewage, which can cause a wide variety of health effects, including gastrointestinal, skin, ear, respiratory, eye, neurologic, and wound infections.", 2017-27948,https://www.federalregister.gov/documents/2018/01/08/2017-27948/public-notification-requirements-for-combined-sewer-overflows-to-the-great-lakes-basin,https://www.gpo.gov/fdsys/pkg/FR-2018-01-08/pdf/2017-27948.pdf,01/08/2018
Expansion of Intergovernmental Advisory Committee,Rule,Federal Communications Commission,"In this document, the Commission adopts revisions to its rules governing the Intergovernmental Advisory Committee (Committee or IAC), which advises the Commission on a range of telecommunications issues affecting local, county, state, and Tribal interests, to expand it from 15 members to 30 members. The IAC has been an important source of information and guidance to the Commission over the past 20 years. The rule change will enhance the IAC's role by allowing for a greater diversity of viewpoints representing our municipal, county, state, and Tribal partners throughout the country.", 2018-00015,https://www.federalregister.gov/documents/2018/01/08/2018-00015/expansion-of-intergovernmental-advisory-committee,https://www.gpo.gov/fdsys/pkg/FR-2018-01-08/pdf/2018-00015.pdf,01/08/2018
2014 Quadrennial Regulatory Review,Rule,Federal Communications Commission,"In this document, an Order on Reconsideration repeals and modifies several of the Commission's broadcast ownership rules. Specifically, this document repeals the Newspaper/Broadcast Cross- Ownership Rule, the Radio/Television Cross-Ownership Rule, and the attribution rule for television joint sales agreements. This document also revises the Local Television Ownership Rule to eliminate the Eight-Voices Test and to modify the Top-Four Prohibition to better reflect the competitive conditions in local markets. This document provides a favorable presumption for waiver of the Local Radio Ownership Rule's market definitions as to transactions in certain embedded markets. Lastly, this document rejects requests to change the definition of Shared Service Agreements (SSAs) and the requirement that commercial television stations disclose SSAs by placing the agreements in each station's online public inspection file. In addition, the document finds that the record supports adoption of an incubator program to promote ownership diversity. The Order on Reconsideration grants in part and denies in part the Petitions for Reconsideration filed separately by the National Association of Broadcasters (NAB), Nexstar Broadcasting, Inc. (Nexstar), and Connoisseur Media LLC (Connoisseur).", 2017-28329,https://www.federalregister.gov/documents/2018/01/08/2017-28329/2014-quadrennial-regulatory-review,https://www.gpo.gov/fdsys/pkg/FR-2018-01-08/pdf/2017-28329.pdf,01/08/2018
Magnuson-Stevens Act Provisions; Fisheries Off West Coast States; Pacific Coast Groundfish Fishery; Pacific Whiting; Pacific Coast Groundfish Fishery Management Plan; Amendment 21-3; Trawl Rationalization Program,Rule,Commerce Department; National Oceanic and Atmospheric Administration,"NMFS issues this final rule to change the management of the Pacific whiting at-sea sectors' (i.e., the Mothership [MS] and Catcher/ Processor [C/P] sectors) allocations for darkblotched rockfish and Pacific ocean perch (POP) by managing the allocations as set-asides rather than as total catch limits, under the authority of the Pacific Coast Groundfish Fishery Management Plan (FMP), and the Magnuson- Stevens Fishery Conservation and Management Act (Magnuson-Stevens Act). This rule revises regulations in accordance with Amendment 21-3 to the FMP (see electronic access under SUPPLEMENTARY INFORMATION) so that higher than anticipated harvest of darkblotched rockfish or POP that exceeds a sector's initial distribution of those species will not require automatic closure of one or more of the Pacific whiting at-sea sectors. This action is intended to reduce the risk of the Pacific whiting at-sea sectors not attaining their respective Pacific whiting allocations due to the incidental catch of darkblotched rockfish or POP causing early closure of those sectors. This action does not change or increase the risk of exceeding darkblotched rockfish or POP ACLs, because it also allows NMFS to close one or both of the Pacific whiting at-sea sectors via automatic action if the species-specific set-aside amounts plus the available reserve for unforeseen catch events, known colloquially as the ``buffer,'' are anticipated to be exceeded. This rule will ensure that the Pacific whiting fishery is managed in accordance with the goals and objectives of the Magnuson-Stevens Act, the FMP, and other applicable laws.", 2018-00135,https://www.federalregister.gov/documents/2018/01/08/2018-00135/magnuson-stevens-act-provisions-fisheries-off-west-coast-states-pacific-coast-groundfish-fishery,https://www.gpo.gov/fdsys/pkg/FR-2018-01-08/pdf/2018-00135.pdf,01/08/2018
Pears Grown in Oregon and Washington; Increased Assessment Rate for Processed Pears,Rule,Agriculture Department; Agricultural Marketing Service,"This rule implements a recommendation from the Processed Pear Committee (Committee) to increase the assessment rate established for the 2017-2018 and subsequent fiscal periods from $7.00 to $8.00 per ton of ``summer/fall'' pears for canning. The assessment rate will remain in effect indefinitely unless modified, suspended, or terminated. This rule also makes administrative revisions to the subpart headings to bring the language into conformance with the Office of Federal Register requirements.", 2017-28505,https://www.federalregister.gov/documents/2018/01/05/2017-28505/pears-grown-in-oregon-and-washington-increased-assessment-rate-for-processed-pears,https://www.gpo.gov/fdsys/pkg/FR-2018-01-05/pdf/2017-28505.pdf,01/05/2018
Onions Grown in South Texas; Increased Assessment Rate,Rule,Agriculture Department; Agricultural Marketing Service,"This rule implements a recommendation from the South Texas Onion Committee (Committee) to increase the assessment rate established for the 2017-18 and subsequent fiscal periods from $0.05 to $0.065 per 50-pound equivalent of onions handled under the Marketing Order (Order). The assessment rate will remain in effect indefinitely unless modified, suspended, or terminated.", 2017-28504,https://www.federalregister.gov/documents/2018/01/05/2017-28504/onions-grown-in-south-texas-increased-assessment-rate,https://www.gpo.gov/fdsys/pkg/FR-2018-01-05/pdf/2017-28504.pdf,01/05/2018
Airworthiness Directives; Fokker Services B.V. Airplanes,Rule,Transportation Department; Federal Aviation Administration,"We are adopting a new airworthiness directive (AD) for certain Fokker Services B.V. Model F28 Mark 0070 and 0100 airplanes. This AD requires contacting the FAA to obtain instructions for addressing the unsafe condition on these products, and doing the actions specified in those instructions. This AD was prompted by a report of an engine multiple fan blade release event. We are issuing this AD to address the unsafe condition on these products.", 2017-28486,https://www.federalregister.gov/documents/2018/01/05/2017-28486/airworthiness-directives-fokker-services-bv-airplanes,https://www.gpo.gov/fdsys/pkg/FR-2018-01-05/pdf/2017-28486.pdf,01/05/2018
